Date,Title,Summary,Link
2025-11-11 01:53,Palo Alto Networks (PANW) Outpaces Stock Market Gains: What You Should Know,"Palo Alto Networks (PANW) closed the most recent trading day at $216.54, moving +2% from the previous trading session. The stock exceeded the S&P 500, which registered a gain of 1.54% for the day. At",https://www.msn.com/en-us/money/top-stocks/palo-alto-networks-panw-outpaces-stock-market-gains-what-you-should-know/ar-AA1Qb7Pd?ocid=BingNewsVerp
2025-11-11 01:53,Palo Alto Networks price target raised to $230 from $215 at Barclays,Barclays raised the firm’s price target on Palo Alto Networks (PANW) to $230 from $215 and keeps an Overweight rating on the shares ahead of the ...,https://www.msn.com/en-us/money/topstocks/palo-alto-networks-price-target-raised-to-230-from-215-at-barclays/ar-AA1Q9pJK?ocid=BingNewsVerp
2025-11-11 01:53,Yahoo Finance,"Tim Erridge, Vice President & Managing Partner, EMEA, Unit 42, Palo Alto Networks and Mary Haigh, Deputy Global Chief Information Officer & Director Digital Delivery Office, BAE Systems PLC discuss ..",https://www.bing.com/news/search?q=site%3afinance.yahoo.com&FORM=NWBCLM
2025-11-11 01:53,Information Age,"Carla Baker, senior director, government affairs UK&I at Palo Alto Networks, analyses what the latest iteration of the UK’s National Cyber Strategy means for organisations The UK’s National Cyber ...",https://www.bing.com/news/search?q=site%3awww.information-age.com&FORM=NWBCLM
2025-11-11 01:53,Royal United Services Institute,"Carla Baker is a Senior Director for Policy & Government Affairs at Palo Alto networks, responsible for driving the company’s public policy agenda in the UK and Ireland, developing policy positions on",https://www.bing.com/news/search?q=site%3awww.rusi.org&FORM=NWBCLM
