Date,Title,Summary,Link
2025-10-22 17:31,Palo Alto Networks (PANW) Outperforms Broader Market: What You Need to Know,"In the latest trading session, Palo Alto Networks (PANW) closed at $207.89, marking a +1.16% move from the previous day.",https://www.msn.com/en-us/money/topstocks/palo-alto-networks-panw-outperforms-broader-market-what-you-need-to-know/ar-AA1OH6kW?ocid=BingNewsVerp
2025-10-22 17:31,,"Tim Erridge, Vice President & Managing Partner, EMEA, Unit 42, Palo Alto Networks and Mary Haigh, Deputy Global Chief ...",https://uk.finance.yahoo.com/video/experts-cybersecurity-ai-resilience-112409524.html
2025-10-22 17:31,Royal United Services Institute,"Carla Baker is a Senior Director for Policy & Government Affairs at Palo Alto networks, responsible for driving the company’s public policy agenda in the UK and Ireland, developing policy positions on",https://www.bing.com/news/search?q=site%3awww.rusi.org&FORM=NWBCLM
2025-10-22 17:31,U.S. government scrambles to stop new hacking campaign blamed on China,"It urged customers to follow the government guidance and upgrade their devices. Sam Rubin, a senior vice president at Palo Alto Networks, said the attackers’ group had become more sophisticated since",https://www.msn.com/en-us/news/technology/us-government-scrambles-to-stop-new-hacking-campaign-blamed-on-china/ar-AA1Njzli?ocid=BingNewsVerp
2025-10-22 17:31,US officials issue ‘emergency’ cybersecurity order after hackers breach at least one government agency,"Unit 42, a division of cyber firm Palo Alto Networks, told CNN that they believe the hackers ... quickly figure out how to take advantage of these vulnerabilities,” said Sam Rubin, a senior vice ...",https://www.msn.com/en-us/technology/cybersecurity/us-officials-issue-emergency-cybersecurity-order-after-hackers-breach-at-least-one-government-agency/ar-AA1NjGlQ?ocid=BingNewsVerp
