Date,Title,Summary,Link
2026-01-03 08:32,Palo Alto Networks (PANW) dips more than broader market: What you should know,"Palo Alto Networks (PANW) ended the recent trading session at $184.20, demonstrating a -1.42% change from the preceding day's closing price. This change lagged the S&P 500's daily loss of 0.74%. At ..",https://www.msn.com/en-us/money/top-stocks/palo-alto-networks-panw-dips-more-than-broader-market-what-you-should-know/ar-AA1TnbnL?ocid=BingNewsVerp
2026-01-03 08:32,Palo Alto Networks upgraded to neutral from sell at Guggenheim,"Guggenheim upgraded Palo Alto Networks (PANW) to Neutral from Sell. Published first on TheFly – the ultimate source for real-time, market-moving ...",https://www.msn.com/en-us/money/other/palo-alto-networks-upgraded-to-neutral-from-sell-at-guggenheim/ar-AA1Tu1DO?ocid=BingNewsVerp
2026-01-03 08:32,"Palo Alto Networks, Google Cloud in multibillion-dollar pact",The companies announced an expanded partnership to strengthen joint engineering efforts. Palo Alto Networks will now integrate Google's Gemini AI.,https://www.msn.com/en-us/money/other/palo-alto-networks-google-cloud-in-multibillion-dollar-pact/ar-AA1SGec0?ocid=BingNewsVerp
2026-01-03 08:32,Information Age,"Carla Baker, senior director, government affairs UK&I at Palo Alto Networks, analyses what the latest iteration of the UK’s National Cyber Strategy means for organisations The UK’s National Cyber ...",https://www.bing.com/news/search?q=site%3awww.information-age.com&FORM=NWBCLM
2026-01-03 08:32,Royal United Services Institute,"Carla Baker is a Senior Director for Policy & Government Affairs at Palo Alto networks, responsible for driving the company’s public policy agenda in the UK and Ireland, developing policy positions on",https://www.bing.com/news/search?q=site%3awww.rusi.org&FORM=NWBCLM
