Date,Title,Summary,Link
2025-10-27 20:23,Palo Alto Networks price target raised to $250 from $212 at Citizens JMP,Citizens JMP analyst Trevor Walsh raised the firm’s price target on Palo Alto Networks (PANW) to $250 from $212 and keeps an Outperform rating on ...,https://www.msn.com/en-us/money/top-stocks/palo-alto-networks-price-target-raised-to-250-from-212-at-citizens-jmp/ar-AA1Phjtp?ocid=BingNewsVerp
2025-10-27 20:23,Palo Alto Networks gains as Citizens reiterates Market Outperform rating,Shares of Palo Alto Networks ( NASDAQ: PANW) gained nearly 1.5% on Monday during early trading hours after Citizens reiterated its Market Outperform rating and raised its price target (PT) to $250 ...,https://www.msn.com/en-us/money/other/palo-alto-networks-gains-as-citizens-reiterates-market-outperform-rating/ar-AA1Ph74Z?ocid=BingNewsVerp
2025-10-27 20:23,Palo Alto Networks Rises 19.5% YTD: Time to Hold or Book Profits?,"Palo Alto Networks is currently at a price-to-sales (P/S) multiple, which is in line with the industry. PANW’s forward 12-month P/S ratio sits at 13.21X compared with the industry’s forward 12-month P",https://www.msn.com/en-us/money/top-stocks/palo-alto-networks-rises-19-5-ytd-time-to-hold-or-book-profits/ar-AA1Oaa7x?ocid=BingNewsVerp
2025-10-27 20:23,Palo Alto Networks (PANW) Surpasses Market Returns: Some Facts Worth Knowing,"Palo Alto Networks (PANW) closed the most recent trading day at $215.09, moving +1.26% from the previous trading session.",https://www.msn.com/en-us/money/topstocks/palo-alto-networks-panw-surpasses-market-returns-some-facts-worth-knowing/ar-AA1P4tH5?ocid=BingNewsVerp
2025-10-27 20:23,,"Tim Erridge, Vice President & Managing Partner, EMEA, Unit 42, Palo Alto Networks and Mary Haigh, Deputy Global Chief ...",https://finance.yahoo.com/video/experts-cybersecurity-ai-resilience-112409524.html
2025-10-27 20:23,Information Age,"Carla Baker, senior director, government affairs UK&I at Palo Alto Networks, analyses what the latest iteration of the UK’s National Cyber Strategy means for organisations The UK’s National Cyber ...",https://www.bing.com/news/search?q=site%3awww.information-age.com&FORM=NWBCLM
2025-10-27 20:23,Royal United Services Institute,"Carla Baker is a Senior Director for Policy & Government Affairs at Palo Alto networks, responsible for driving the company’s public policy agenda in the UK and Ireland, developing policy positions on",https://www.bing.com/news/search?q=site%3awww.rusi.org&FORM=NWBCLM
