Date,Title,Summary,Link
2025-10-28 20:27,Palo Alto Networks Rises 19.5% YTD: Time to Hold or Book Profits?,"Palo Alto Networks is currently at a price-to-sales (P/S) multiple, which is in line with the industry. PANW’s forward 12-month P/S ratio sits at 13.21X compared with the industry’s forward 12-month P",https://www.msn.com/en-us/money/top-stocks/palo-alto-networks-rises-19-5-ytd-time-to-hold-or-book-profits/ar-AA1Oaa7x?ocid=BingNewsVerp
2025-10-28 20:27,Palo Alto Networks launches AI-driven security offerings to tackle cyberattacks,"Palo Alto Networks is expanding its artificial intelligence-powered cybersecurity offerings, as clients seek to secure their business operations from rising hacking incidents. The company's AI tools,",https://www.msn.com/en-us/technology/cybersecurity/palo-alto-networks-launches-ai-driven-security-offerings-to-tackle-cyberattacks/ar-AA1Pmvxo?ocid=BingNewsVerp
2025-10-28 20:27,,"Tim Erridge, Vice President & Managing Partner, EMEA, Unit 42, Palo Alto Networks and Mary Haigh, Deputy Global Chief ...",https://finance.yahoo.com/video/experts-cybersecurity-ai-resilience-112409524.html
2025-10-28 20:27,Information Age,"Carla Baker, senior director, government affairs UK&I at Palo Alto Networks, analyses what the latest iteration of the UK’s National Cyber Strategy means for organisations The UK’s National Cyber ...",https://www.bing.com/news/search?q=site%3awww.information-age.com&FORM=NWBCLM
2025-10-28 20:27,Royal United Services Institute,"Carla Baker is a Senior Director for Policy & Government Affairs at Palo Alto networks, responsible for driving the company’s public policy agenda in the UK and Ireland, developing policy positions on",https://www.bing.com/news/search?q=site%3awww.rusi.org&FORM=NWBCLM
