Date,Title,Summary,Link
2025-12-19 08:34,Can Cortex XSIAM Become Palo Alto Networks' Next Major Growth Engine?,"PANW's Cortex XSIAM is landing bigger deals and high-spending customers, signaling it could emerge as a key growth driver.",https://www.msn.com/en-us/money/topstocks/can-cortex-xsiam-become-palo-alto-networks-next-major-growth-engine/ar-AA1SBEk3?ocid=BingNewsVerp
2025-12-19 08:34,Palo Alto Networks price target raised to $245 from $228 at Morgan Stanley,Morgan Stanley raised the firm’s price target on Palo Alto Networks (PANW) to $245 from $228 and keeps an Overweight rating on the shares.,https://www.msn.com/en-us/money/top-stocks/palo-alto-networks-price-target-raised-to-245-from-228-at-morgan-stanley/ar-AA1SBBko?ocid=BingNewsVerp
2025-12-19 08:34,Morgan Stanley maintains Palo Alto Networks (PANW) overweight recommendation,"Fintel reports that on December 18, 2025, Morgan Stanley maintained coverage of Palo Alto Networks (NasdaqGS:PANW) with a Overweight recommendation. Analyst Price Forecast Suggests 24.46% Upside As of",https://www.msn.com/en-us/money/top-stocks/morgan-stanley-maintains-palo-alto-networks-panw-overweight-recommendation/ar-AA1SEbY5?ocid=BingNewsVerp
2025-12-19 08:34,Information Age,"Carla Baker, senior director, government affairs UK&I at Palo Alto Networks, analyses what the latest iteration of the UK’s National Cyber Strategy means for organisations The UK’s National Cyber ...",https://www.bing.com/news/search?q=site%3awww.information-age.com&FORM=NWBCLM
2025-12-19 08:34,Royal United Services Institute,"Carla Baker is a Senior Director for Policy & Government Affairs at Palo Alto networks, responsible for driving the company’s public policy agenda in the UK and Ireland, developing policy positions on",https://www.bing.com/news/search?q=site%3awww.rusi.org&FORM=NWBCLM
